{
  "$schema": "https://json-schema.org/draft/2020-12/schema",
  "title": "BRIDGEPORT Database Type Plugin",
  "type": "object",
  "required": ["name", "displayName", "connectionFields"],
  "properties": {
    "$schema": { "type": "string" },
    "name": {
      "type": "string",
      "pattern": "^[a-z0-9-]+$",
      "description": "Unique identifier (lowercase, hyphens allowed)"
    },
    "displayName": {
      "type": "string",
      "description": "Human-readable name"
    },
    "defaultPort": {
      "type": "integer",
      "description": "Default connection port"
    },
    "connectionFields": {
      "type": "array",
      "items": {
        "type": "object",
        "required": ["name", "label", "type"],
        "properties": {
          "name": { "type": "string" },
          "label": { "type": "string" },
          "type": { "type": "string", "enum": ["text", "number", "password"] },
          "required": { "type": "boolean" },
          "default": {}
        },
        "additionalProperties": false
      }
    },
    "backupCommand": {
      "type": "string",
      "description": "Backup command template with {{placeholders}}"
    },
    "restoreCommand": {
      "type": "string",
      "description": "Restore command template with {{placeholders}}"
    },
    "commands": {
      "type": "array",
      "items": {
        "type": "object",
        "required": ["name", "displayName", "command"],
        "properties": {
          "name": { "type": "string", "pattern": "^[a-z0-9-]+$" },
          "displayName": { "type": "string" },
          "command": { "type": "string" },
          "description": { "type": "string" },
          "sortOrder": { "type": "integer", "minimum": 0 }
        },
        "additionalProperties": false
      }
    },
    "monitoring": {
      "type": "object",
      "description": "Monitoring configuration for collecting database metrics",
      "properties": {
        "connectionMode": {
          "type": "string",
          "enum": ["sql", "ssh"],
          "description": "How to connect: 'sql' for direct DB connection, 'ssh' for remote commands"
        },
        "driver": {
          "type": "string",
          "enum": ["pg", "mysql2"],
          "description": "Node.js driver to use for SQL connections"
        },
        "queries": {
          "type": "array",
          "items": {
            "type": "object",
            "required": ["name", "displayName", "query", "resultType"],
            "properties": {
              "name": { "type": "string" },
              "displayName": { "type": "string" },
              "query": { "type": "string" },
              "resultType": { "type": "string", "enum": ["scalar", "row", "rows"] },
              "unit": { "type": "string" },
              "chartGroup": { "type": "string" },
              "resultMapping": {
                "type": "object",
                "description": "Maps column names to result field names"
              }
            },
            "additionalProperties": false
          }
        }
      },
      "additionalProperties": false
    }
  },
  "additionalProperties": false
}
