{
  "$schema": "../schemas/database-type.schema.json",
  "name": "postgres",
  "displayName": "PostgreSQL",
  "defaultPort": 5432,
  "connectionFields": [
    { "name": "host", "label": "Host", "type": "text", "required": true, "default": "localhost" },
    { "name": "port", "label": "Port", "type": "number", "required": true, "default": 5432 },
    { "name": "databaseName", "label": "Database Name", "type": "text", "required": true },
    { "name": "username", "label": "Username", "type": "text", "required": true },
    { "name": "password", "label": "Password", "type": "password", "required": true }
  ],
  "backupCommand": "pg_dump --no-password -h {{host}} -p {{port}} -U {{username}} -d {{databaseName}} -f \"{{outputFile}}\"",
  "restoreCommand": "pg_restore --no-password -h {{host}} -p {{port}} -U {{username}} -d {{databaseName}} \"{{inputFile}}\"",
  "commands": [
    { "name": "shell", "displayName": "PostgreSQL Shell", "command": "psql -h {{host}} -p {{port}} -U {{username}} {{databaseName}}", "description": "Interactive PostgreSQL shell", "sortOrder": 0 },
    { "name": "vacuum", "displayName": "Vacuum Analyze", "command": "psql -h {{host}} -p {{port}} -U {{username}} -d {{databaseName}} -c \"VACUUM ANALYZE\"", "description": "Run VACUUM ANALYZE", "sortOrder": 1 }
  ],
  "monitoring": {
    "connectionMode": "sql",
    "driver": "pg",
    "queries": [
      {
        "name": "dbSize",
        "displayName": "Database Size",
        "query": "SELECT pg_database_size(current_database()) AS value",
        "resultType": "scalar",
        "unit": "bytes"
      },
      {
        "name": "tableCount",
        "displayName": "Table Count",
        "query": "SELECT count(*) AS value FROM information_schema.tables WHERE table_schema = 'public' AND table_type = 'BASE TABLE'",
        "resultType": "scalar"
      },
      {
        "name": "totalRows",
        "displayName": "Total Row Estimate",
        "query": "SELECT coalesce(sum(n_live_tup), 0) AS value FROM pg_stat_user_tables",
        "resultType": "scalar"
      },
      {
        "name": "totalIndexSize",
        "displayName": "Total Index Size",
        "query": "SELECT coalesce(sum(pg_indexes_size(schemaname || '.' || tablename)), 0) AS value FROM pg_stat_user_tables",
        "resultType": "scalar",
        "unit": "bytes"
      },
      {
        "name": "deadTuples",
        "displayName": "Dead Tuples",
        "query": "SELECT coalesce(sum(n_dead_tup), 0) AS value FROM pg_stat_user_tables",
        "resultType": "scalar"
      },
      {
        "name": "deadTupleRatio",
        "displayName": "Dead Tuple Ratio",
        "query": "SELECT CASE WHEN coalesce(sum(n_live_tup), 0) + coalesce(sum(n_dead_tup), 0) = 0 THEN 0 ELSE round(sum(n_dead_tup)::numeric / (sum(n_live_tup) + sum(n_dead_tup)) * 100, 2) END AS value FROM pg_stat_user_tables",
        "resultType": "scalar",
        "unit": "%"
      },
      {
        "name": "oldestUnvacuumed",
        "displayName": "Oldest Unvacuumed Table",
        "query": "SELECT coalesce(extract(epoch FROM (now() - min(last_autovacuum)))::numeric, 0) AS value FROM pg_stat_user_tables WHERE last_autovacuum IS NOT NULL",
        "resultType": "scalar",
        "unit": "s"
      },
      {
        "name": "topTableSizes",
        "displayName": "Top Tables by Size",
        "query": "SELECT schemaname || '.' || tablename AS name, pg_total_relation_size(schemaname || '.' || tablename) AS size, n_live_tup AS rows FROM pg_stat_user_tables ORDER BY pg_total_relation_size(schemaname || '.' || tablename) DESC LIMIT 10",
        "resultType": "rows",
        "resultMapping": { "name": "name", "size": "size", "rows": "rows" }
      }
    ]
  }
}
